[
  {
    "article_number": 183,
    "title": "تعریف عقد",
    "text": "عقد عبارت است از اینکه یک یا چند نفر در مقابل یک یا چند نفر دیگر تعهد بر امری نمایند و مورد قبول آن‌ها باشد.",
    "explanation": "تعریف عمومی عقد در قانون مدنی. عقد یعنی توافقی که در آن دو طرف قول انجام کاری را می‌دهند.",
    "examples": [
      "توافق دو نفر برای فروش خانه",
      "اجاره مغازه"
    ],
    "key_points": [
      "عقد نیاز به ایجاب و قبول دارد",
      "عقد می‌تواند لازم یا جایز باشد"
    ],
    "tags": [
      "عقد",
      "معامله",
      "ایجاب",
      "قبول"
    ],
    "related_articles": [
      184,
      185
    ],
    "references": [
      "قانون مدنی ایران – باب اول از کتاب سوم"
    ],
    "category": "معاملات",
    "subcategory": "عقود",
    "status": "active",
    "last_modified": "1307/05/08"
  },
  {
    "article_number": 184,
    "title": "انواع عقد",
    "text": "عقود و معاملات بر سه قسم‌اند: لازم، جایز و خیاری.",
    "explanation": "تقسیم‌بندی انواع عقد از نظر الزام‌آور بودن. معاملات ممکن است برگشت‌پذیر یا غیرقابل برگشت باشند.",
    "examples": [
      "بیع (فروش) عقد لازم است",
      "وکالت عقد جایز است"
    ],
    "key_points": [
      "عقد لازم بدون رضایت طرفین منحل نمی‌شود",
      "عقد جایز قابل فسخ توسط هر یک از طرفین است",
      "عقد خیاری دارای حق فسخ برای یکی از طرفین است"
    ],
    "tags": [
      "عقد_لازم",
      "عقد_جایز",
      "عقد_خیاری",
      "انواع_عقد"
    ],
    "related_articles": [
      183,
      185,
      186
    ],
    "references": [
      "قانون مدنی ایران – ماده ۱۸۴"
    ],
    "category": "معاملات",
    "subcategory": "عقود",
    "status": "active",
    "last_modified": "1307/05/08"
  }
]

