[
  {
    "article_number": 1,
    "title": "اصل آزادی مالکیت",
    "text": "مالکیت عبارت است از سلطنت شخص بر عین یا منفعت برای استیفای تمام منافع آن به هر طریق که قانوناً ممنوع نباشد.",
    "explanation": "این ماده تعریف کلی از مالکیت را ارائه می‌دهد و بیان می‌کند که مالک حق استفاده از تمام منافع مال خود را دارد مگر آنکه قانون محدودیتی ایجاد کرده باشد.",
    "examples": [
      "مالک خانه می‌تواند در آن سکونت کند یا آن را اجاره دهد",
      "مالک زمین می‌تواند آن را کشاورزی کند یا بفروشد"
    ],
    "key_points": [
      "مالکیت شامل سلطه بر عین یا منفعت است",
      "مالک می‌تواند از تمام منافع مال استفاده کند",
      "تنها محدودیت‌های قانونی معتبر است"
    ],
    "tags": [
      "مالکیت",
      "آزادی",
      "اموال",
      "سلطه",
      "منافع"
    ],
    "related_articles": [
      2,
      3,
      30,
      31
    ],
    "references": [
      "قانون مدنی ایران – ماده ۱"
    ],
    "category": "اموال",
    "subcategory": "مالکیت",
    "status": "active",
    "last_modified": "1307/05/08"
  },
  {
    "article_number": 2,
    "title": "محدودیت‌های مالکیت",
    "text": "مالک نمی‌تواند در ملک خود تصرفاتی بکند که موجب ضرر دیگران یا مخالف با موازین شرعی یا قانونی باشد.",
    "explanation": "این ماده بیان می‌کند که آزادی مالکیت مطلق نیست و مالک باید از ایجاد ضرر برای دیگران و نقض قوانین خودداری کند.",
    "examples": [
      "مالک نمی‌تواند دیواری بسازد که نور خانه همسایه را بگیرد",
      "مالک نمی‌تواند در ملک خود کارخانه‌ای بسازد که آلودگی ایجاد کند"
    ],
    "key_points": [
      "مالکیت محدود به عدم ضرر به دیگران است",
      "تصرفات باید با موازین شرعی مطابقت داشته باشد",
      "تصرفات باید با قوانین مطابقت داشته باشد"
    ],
    "tags": [
      "محدودیت_مالکیت",
      "ضرر",
      "حقوق_همسایگی",
      "موازین_شرعی"
    ],
    "related_articles": [
      1,
      3,
      690,
      691
    ],
    "references": [
      "قانون مدنی ایران – ماده ۲",
      "قاعده لاضرر"
    ],
    "category": "اموال",
    "subcategory": "مالکیت",
    "status": "active",
    "last_modified": "1307/05/08"
  }
]

